{
  "$schema": "https://json-schema.org/draft/2020-12/schema",
  "$id": "https://affiant.dev/schemas/0.5.0/draft.schema.json",
  "title": "Draft",
  "description": "The fields whose Conversation tag and utterance-span binding an earlier turn of the same conversation established, held by the host for the gate between turns so that a later turn's proposal can carry them (GT-7). It is not an Affidavit and not a Docket entry: it has no entry id, status, decision or attestation, and nothing in it is sworn to. It is keyed by the tenant, the conversation and the tool, and holds exactly the fields whose tag in force is Conversation bound to an utterance-span that names its message.",
  "type": "object",
  "additionalProperties": false,
  "required": [
    "protocolVersion",
    "tenantId",
    "conversationId",
    "toolName",
    "fields",
    "updatedAt"
  ],
  "properties": {
    "protocolVersion": {
      "$ref": "https://affiant.dev/schemas/0.5.0/common.schema.json#/$defs/protocolVersion"
    },
    "tenantId": {
      "description": "The tenant the draft belongs to; one part of the draft's key.",
      "$ref": "https://affiant.dev/schemas/0.5.0/common.schema.json#/$defs/identifier"
    },
    "conversationId": {
      "description": "The conversation the draft belongs to; one part of the draft's key.",
      "$ref": "https://affiant.dev/schemas/0.5.0/common.schema.json#/$defs/identifier"
    },
    "toolName": {
      "description": "The tool whose proposal the draft is for; one part of the draft's key.",
      "$ref": "https://affiant.dev/schemas/0.5.0/common.schema.json#/$defs/identifier"
    },
    "fields": {
      "description": "The drafted fields, one entry per field name; a later statement of the same name replaces the earlier (GT-7). A draft holds at least one field.",
      "type": "array",
      "minItems": 1,
      "items": {
        "type": "object",
        "additionalProperties": false,
        "required": [
          "name",
          "value",
          "tag"
        ],
        "properties": {
          "name": {
            "description": "The field's name in the proposal.",
            "$ref": "https://affiant.dev/schemas/0.5.0/common.schema.json#/$defs/identifier"
          },
          "value": {
            "description": "The value as the proposal carried it.",
            "$ref": "https://affiant.dev/schemas/0.5.0/common.schema.json#/$defs/jsonValue"
          },
          "tag": {
            "description": "The Conversation tag the earlier turn minted, with its utterance-span binding, which names the message it was read from.",
            "allOf": [
              {
                "$ref": "https://affiant.dev/schemas/0.5.0/provenance-tag.schema.json"
              },
              {
                "type": "object",
                "properties": {
                  "source": {
                    "const": "Conversation"
                  },
                  "binding": {
                    "type": "object",
                    "required": [
                      "kind",
                      "ref"
                    ],
                    "properties": {
                      "kind": {
                        "const": "utterance-span"
                      },
                      "ref": {
                        "type": "object",
                        "required": [
                          "messageId"
                        ],
                        "properties": {
                          "messageId": true
                        }
                      }
                    }
                  }
                },
                "required": [
                  "binding"
                ]
              }
            ]
          }
        }
      }
    },
    "updatedAt": {
      "description": "When the draft was last written.",
      "$ref": "https://affiant.dev/schemas/0.5.0/common.schema.json#/$defs/isoInstant"
    }
  }
}
